Name,Description,Latitude,Longitude,InfoURL,ImageURL,image
UCSB,A great university located along the California coast!,34.416929,-119.845991,"https://en.wikipedia.org/wiki/University_of_California, _Santa_Barbara",https://www.history.ucsb.edu/wp-content/uploads/La goonFall20141.jpg ,
Goleta Beach Park,Known for its long fishing pier and sunbathing beaches. These 29 acres are often a destination for bicyclists on the area's paved trail system.,34.4168,-119.8322,https://www.countyofsb.org/parks/day-use/goleta-beach.sbc,https://www.californiabeaches.com/wp-content/uploads/2014/09/bigs-Goleta-Beach-Pier-Golden-Beach-Morning-with-Birds-E1-Large-e1510802187334-1000x595.jpg,
More Mesa Beach,More Mesa Beach is a narrow beach hidden away below the bluffs of More Mesa Park in Santa Barbara. Due to its seclusion it has a reputation as a clothing-optional beach.,34.4171,-119.7879,https://www.californiabeaches.com/beach/more-mesa-beach/,https://www.californiabeaches.com/wp-content/uploads/2014/09/bigs-More-Mesa-Beach-Santa-Barbara-Goleta-California-Coast-Line-Large-e1512516489411-1000x653.jpg,
Santa Barbara Shores Park,"A natural area, this park is still under development. Presently there exist hiking trails over coastal bluffs and through thick eucalyptus groves.",34.4226,-119.8964,https://www.exploratoryglory.com/travel-blog/santa-barbara-shores-park-california,https://images.squarespace-cdn.com/content/v1/5adf25b575f9ee4695083a1a/1592179557164-AKPLEX10ZPLNFD7HY6QG/ke17ZwdGBToddI8pDm48kDHPSfPanjkWqhH6pl6g5ph7gQa3H78H3Y0txjaiv_0fDoOvxcdMmMKkDsyUqMSsMWxHk725yiiHCCLfrh8O1z4YTzHvnKhyp6Da-NYroOW3ZGjoBKy3azqku80C789l0mwONMR1ELp49Lyc52iWr5dNb1QJw9casjKdtTg1_-y4jz4ptJBmI9gQmbjSQnNGng/santa-barbara-shores-park-california.jpg?format=1500w,
Inspiration Point,Inspiration Point is a 3.5 mile heavily trafficked out and back trail that offers the chance to see wildlife and is rated as moderate.,34.472,-119.7143,https://www.alltrails.com/trail/us/california/inspiration-point--2,https://www.sbhotels.com/blog/wp-content/uploads/2019/04/SBHike-700x525.jpg,
Santa Barbara County Superior Court,The Santa Barbara County Courthouse is a signature building structure in the city of Santa Barbara. It is built in the Spanish Colonial style and was built in 1929 and still functions as a working courthouse. ,34.424,-119.7021,https://www.sbcourts.org/,https://www.santaynezvalleystar.com/wp-content/uploads/2020/05/original_santa-barbara-courthouse-mark-weber0_caba8294-5056-a348-3a8d6ad3f36186c1-678x381.jpg,